{
  "schemaVersion": "1.3.0",
  "retrieved": "2026-01-01",
  "analysisCrs": "EPSG:5070",
  "gridResolutionMeters": 30,
  "aggregationUnit": "EPA Omernik ecoregion (unsimplified Region 10 Albers source)",
  "sources": {
    "terrain": {
      "source": "USGS 3D Elevation Program (3DEP) 1/3 arc-second seamless DEM",
      "sourceUrl": "https://www.usgs.gov/3d-elevation-program",
      "vintage": "continuously updated (seamless VRT)",
      "resolutionMeters": 10,
      "method": "area-weighted mean elevation (exactextract) on a 30m EPSG:5070 grid; Horn 3x3 slope and aspect (cells without a full neighborhood excluded; flat cells carry no aspect); aspect summarized as the area-weighted, gradient-magnitude-weighted (resultant) circular mean, so near-flat cells contribute in proportion to the directional signal they carry; coveragePct is the polygon-weighted valid-elevation fraction; adds elevBands (ten fractions of valid-elevation area over the ELEV_BAND_EDGES_M bands: below 0, eight half-open [edge, next) intervals, 4000-plus) and aspectDistribution (eight cardinals plus flat, the exactly-zero-gradient cells, plus excluded, the neighborhood-exclusion cells; a partition of valid-elevation area)",
      "methodVersion": 3,
      "acquired": "2026-01-01",
      "materializedRasterSha256": "0000000000000000000000000000000000000000000000000000000000000000"
    }
  },
  "bundles": {
    "1": {
      "level": 3,
      "usL3Code": "1",
      "usL3Name": "Synthetic Flats",
      "terrain": {
        "elevMeanM": 562.3,
        "elevMinM": 505.2,
        "elevMaxM": 623.1,
        "slopeMeanDeg": 10.23,
        "aspectMeanDeg": 290.8,
        "aspectCardinal": "W",
        "coveragePct": 92.8,
        "elevBands": [
          0.0,
          0.0,
          1.0,
          0.0,
          0.0,
          0.0,
          0.0,
          0.0,
          0.0,
          0.0
        ],
        "aspectDistribution": {
          "N": 0.086,
          "NE": 0.0,
          "E": 0.0,
          "SE": 0.012,
          "S": 0.028,
          "SW": 0.084,
          "W": 0.487,
          "NW": 0.276,
          "flat": 0.0,
          "excluded": 0.027
        }
      },
      "unavailable": []
    },
    "2": {
      "level": 3,
      "usL3Code": "2",
      "usL3Name": "Nodata Notch",
      "terrain": {
        "elevMeanM": 569.8,
        "elevMinM": 545.4,
        "elevMaxM": 595.2,
        "slopeMeanDeg": 5.8,
        "aspectMeanDeg": 235.6,
        "aspectCardinal": "SW",
        "coveragePct": 64.5,
        "elevBands": [
          0.0,
          0.0,
          1.0,
          0.0,
          0.0,
          0.0,
          0.0,
          0.0,
          0.0,
          0.0
        ],
        "aspectDistribution": {
          "N": 0.006,
          "NE": 0.0,
          "E": 0.14,
          "SE": 0.107,
          "S": 0.081,
          "SW": 0.151,
          "W": 0.273,
          "NW": 0.0,
          "flat": 0.0,
          "excluded": 0.242
        }
      },
      "unavailable": []
    },
    "3": {
      "level": 3,
      "usL3Code": "3",
      "usL3Name": "Holey Ridge",
      "terrain": {
        "elevMeanM": 621.2,
        "elevMinM": 573.1,
        "elevMaxM": 658.8,
        "slopeMeanDeg": 8.76,
        "aspectMeanDeg": 352.0,
        "aspectCardinal": "N",
        "coveragePct": 100.0,
        "elevBands": [
          0.0,
          0.0,
          1.0,
          0.0,
          0.0,
          0.0,
          0.0,
          0.0,
          0.0,
          0.0
        ],
        "aspectDistribution": {
          "N": 0.17,
          "NE": 0.145,
          "E": 0.223,
          "SE": 0.052,
          "S": 0.064,
          "SW": 0.019,
          "W": 0.183,
          "NW": 0.144,
          "flat": 0.0,
          "excluded": 0.0
        }
      },
      "unavailable": []
    },
    "4": {
      "level": 3,
      "usL3Code": "4",
      "usL3Name": "Empty Void",
      "terrain": {
        "unavailable": true,
        "reason": "empty geometry"
      },
      "unavailable": [
        "terrain"
      ]
    }
  }
}
